{
  "check_id": "github.change.branch-protection",
  "ksis": [
    "KSI-CMT-RMV",
    "KSI-CMT-RVP"
  ],
  "collector": {
    "path": "src/collectors/github/change.mjs",
    "version": "1.0.0",
    "source_commit": "04687dbadcdc2f9c428e1315189f53ae7bf6ae0b"
  },
  "collected_at": "2026-09-17T09:24:19.048Z",
  "scope": {
    "repositories": [
      "RootCawsLLC/ksi-harness"
    ],
    "branch_window_days": 30,
    "since": "2026-08-18T09:24:19.048Z"
  },
  "population": {
    "expected": 1,
    "examined": 1,
    "complete": true,
    "decidable": 1,
    "source_of_truth": "Declared production default branches, with classic protection and rulesets read as a union",
    "enumerated_from": "the repositories declared in the profile, counted before any protection setting was read"
  },
  "result": "warn",
  "assertion": "Every production default branch requires review before merge and enumerates every actor permitted to bypass that requirement.",
  "items": [
    {
      "id": "RootCawsLLC/ksi-harness:main",
      "status": "warn",
      "detail": "Token lacks permission to verify this: Resource not accessible by integration",
      "observed": {
        "reason": "permission"
      }
    }
  ],
  "metric": {
    "metric_id": "github.change.protected_branches",
    "value": 0,
    "unit": "ratio"
  },
  "chain": {
    "previous_sha256": "ea6b0885736a2f6f493c38b4016a350bcf0888e1de10dc0da9fc469ba3a367bc",
    "index": 32
  },
  "integrity": {
    "content_sha256": "ccfde20f8ee350218094f211dfd1d3db95a8f9865e6f9f41199e76a42bd6d2cf",
    "signed": false
  }
}
