{
  "check_id": "github.supply-chain.dependency-alerts",
  "ksis": [
    "KSI-SCR-MON"
  ],
  "collector": {
    "path": "src/collectors/github/dependencies.mjs",
    "version": "1.0.0",
    "source_commit": "aca8b2dd650bbb00a92ce38ea029f027d1eaec74"
  },
  "collected_at": "2026-08-21T05:52:49.868Z",
  "scope": {
    "repositories": [
      "RootCawsLLC/ksi-harness"
    ],
    "remediation_windows_days": {
      "critical": 7,
      "high": 30,
      "medium": 90,
      "low": 180
    }
  },
  "population": {
    "expected": 1,
    "examined": 1,
    "complete": true,
    "decidable": 1,
    "source_of_truth": "the vulnerability-alerting state of each declared repository, plus every open dependency alert it reports",
    "enumerated_from": "the repositories declared in the profile, counted before any alert listing was made; each repository contributes one monitoring-state member whether or not it reports any alert"
  },
  "result": "warn",
  "assertion": "Every declared repository has automated upstream vulnerability monitoring enabled, and no open alert has been outstanding longer than the remediation window its severity declares.",
  "items": [
    {
      "id": "monitoring/RootCawsLLC/ksi-harness",
      "status": "warn",
      "detail": "Token lacks permission to verify this: Resource not accessible by integration",
      "observed": {
        "reason": "permission"
      }
    }
  ],
  "metric": {
    "metric_id": "github.supply_chain.alerts_within_window",
    "value": 0,
    "unit": "ratio"
  },
  "chain": {
    "previous_sha256": "ce4dec011bc8414143ae42a027ce4ee4b3c0e57e502d9ef94f0f9425c54558e9",
    "index": 3
  },
  "integrity": {
    "content_sha256": "4341d575654339f73918c57f00ff9d3915f3bb2aa8f6a924e6c099a8df9f84ab",
    "signed": false
  }
}
